name,description,traits
"Mutated","Most derro go through the process of indoctrination into their society and come out of it with visions and delusion, paranoia and mania. You, on the other hand, were not affected as much mentally as you were physically. The connection to the dark deities of your people made you stronger and gave you a physical manifestation of their gift that other derro look upon with envy and awe.","Ability Score Increase: Your Strength score increases by 1. | Athletic Training: You have proficiency in the Athletics skill, and you are proficient with two
martial weapons of your choice. | Otherworldly Influence: Your close connection to the strange powers that your people worship has mutated
your form. Choose one of the following:

Alien Appendage. You have a tentacle-like growth on your body. This tentacle is
a natural melee weapon, which you can use to make unarmed strikes. When you hit
with it, your tentacle deals bludgeoning damage equal to 1d4 + your Strength
modifier, instead of the bludgeoning damage normal for an unarmed strike. This
tentacle has a reach of 5 feet and can lift a number of pounds equal to double
your Strength score. The tentacle can't wield weapons or shields or perform
tasks that require manual precision, such as performing the somatic components
of a spell, but it can perform simple tasks, such as opening an unlocked door or
container, stowing or retrieving an object, or pouring the contents out of a
vial. Tainted Blood. Your blood is tainted by your connection with otherworldly
entities. When you take piercing or slashing damage, you can use your reaction
to force your blood to spray out of the wound. You and each creature within 5
feet of you take necrotic damage equal to your level. Once you use this trait,
you can't use it again until you finish a short or long rest. Tenebrous Flesh.
Your skin is rubbery and tenebrous, granting you a +1 bonus to your Armor Class."
"Pantheran","Pantheran catfolk are a wise, observant, and patient people who pride themselves on being resourceful and self-sufficient. Less social than many others of their kind, these catfolk typically dwell in small, close-knit family groups in the forests, jungles, and grasslands of the world, away from larger population centers or cities. Their family clans teach the importance of living off of and protecting the natural world, and pantherans act swiftly and mercilessly when their forest homes are threatened by outside forces. Conversely, pantherans can be the most fierce and loyal of neighbors to villages who respect nature and who take from the land and forest no more than they need. As a pantheran, you value nature and kinship, and your allies know they can count on your wisdom and, when necessary, your claws.","Ability Score Increase: Your Wisdom score increases by 1. | Hunter's Charge: Once per turn, if you move at least 10 feet toward a target and hit it with a
melee weapon attack in the same turn, you can use a bonus action to attack that
creature with your Cat's Claws. You can use this trait a number of times per day
equal to your proficiency bonus, and you regain all expended uses when you
finish a long rest. | One With the Wilds: You have proficiency in one of the following skills of your choice: Insight,
Medicine, Nature, or Survival."
"Purified","You were born into the caste that produces the leaders and planners, the priests and wizards, the generals and officers of drow society. Your people, it is believed, were tested by the beneficent powers you worship, and you passed those tests to become something more. Your innate magic proves your superiority over your fellows.","Ability Score Increase: Your Charisma score increases by 1. | Innate Spellcasting: You know the poison spray cantrip. When you reach 3rd level, you can cast
suggestion once with this trait and regain the ability to do so when you finish
a long rest. When you reach 5th level, you can cast the tongues spell once and
regain the ability to do so when you finish a long rest. Intelligence is your
spellcasting ability for these spells. | Born Leader: You gain proficiency with two of the following skills of your choice: History,
Insight, Performance, and Persuasion."
"Ravenfolk","Your darakhul character was a ravenfolk (see Midgard Heroes Handbook) before transforming into a darakhul. Your new form feels different. It is more powerful and less fidgety, and your beak has become razor sharp. There is still room for trickery, of course. But with your new life comes a disconnection from the All Father. Does this loss gnaw at you like your new hunger or do you feel freed from the destiny of your people?","Ability Score Increase: Your Dexterity score increases by 2. | Sudden Bite and Flight: If you surprise a creature during the first round of combat, you can make a bite
attack as a bonus action. If it hits, you can immediately take the Dodge action
as a reaction."
"Tiefling Heritage","Your darakhul character was a tiefling before transforming into a darakhul. You are no stranger to the pull of powerful forces raging through your blood. You have traded one dark pull for another, and this one seems much stronger. Is that a good feeling, or do you miss your old one?","Ability Score Increase: Your Charisma score increases by 1. | Necrotic Rebuke: When you are hit by a weapon attack, you can use a reaction to envelop the
attacker in shadowy flames. The attacker takes necrotic damage equal to your
Charisma modifier (minimum of 1), and it has disadvantage on attack rolls until
the end of its next turn. You must finish a long rest before you can use this
feature again."
"Trollkin Heritage","Your darakhul character was a trollkin (see Midgard Heroes Handbook) before transforming into a darakhul. Others saw you as a monster because of your ancestry. You became inured to the fearful looks and hurried exits of those around you. If only they could see you now. Does your new state make you seek revenge on them, or are you able to maintain your self-control despite the new urges you feel?","Ability Score Increase: Your Strength score increases by 2. | Regenerative Bite: The regenerative powers of your trollkin heritage are less potent than they were
in life and need a little help. As an action, you can make a bite attack against
a creature that isn't undead or a construct. On a hit, you regain hit points
(minimum of 1) equal to half the amount of damage dealt. Once you use this
trait, you can't use it again until you finish a long rest."
"Uncorrupted","Someone in your past failed to do their job of driving you to the brink of insanity. It might have been a doting parent that decided to buck tradition. It might have been a touched seer who had visions of your future without the connections to the mad gods your people serve. It might have been a whole outcast community of derro rebels who refused to serve the madness of your ancestors. Whatever happened in your past, you are quite sane—or at least quite sane for a derro.","Ability Score Increase: Your Wisdom score increases by 1. | Psychic Barrier: Your time among your less sane brethren has inured you to their madness. You
have resistance to psychic damage, and you have advantage on ability checks and
saving throws made against effects that inflict insanity, such as spells like
contact other plane and symbol, and effects that cause short-term, long-term, or
indefinite madness. | Studied Insight: You are skilled at discerning other creature's motives and intentions. You have
proficiency in the Insight skill, and, if you study a creature for at least 1
minute, you have advantage on any initiative checks in combat against that
creature for the next hour."